{
 "schema_version": 1,
 "task_id": "M06-B-FU4",
 "candidate_tree": "54a676b3123a0da982c9f863c85ac3322e062e1e",
 "engine": {"rust": "rustc 1.98.1 (48a229cea 2026-09-01)", "bevy": "0.19.1", "avian": "0.7.0"},
 "created_at": "2026-10-18T12:27:25Z",
 "command": {"argv": ["cargo", "test", "--locked", "-p", "cs_app", "--test", "cs_app_tests_d", "--", "accept_m06_b_fu4_", "--include-ignored"], "cwd": "/Users/linus/coding/rust-crimson-skies/swe2-max-1", "exit_code": 0},
 "source": {"install_sha256": "b4e780ab84cf31d85b8452fbfcec1478137768e32d9a75ccedc4c1847c631978", "content_sha256": "a0223506e512b50c0e0445ba73204a0461e60197e28d58a7f7144632d262c12d"},
 "seed": 0,
 "ticks": {"start": 0, "end": 0},
 "overrides": [],
 "capabilities": ["retail", "synthetic"],
 "tests": {"discovered": 2, "executed": 2, "passed": 2, "failed": 0, "ignored": 0},
 "assertions": [{"id": "accept_m06_b_fu4_a_mission_scoped_unknown_reaches_only_the_work_order_it_was_measured_for", "status": "pass", "evidence": ["cargo-test.log"]}, {"id": "accept_m06_b_fu4_m12s_record_names_the_passenger_identity_limitation_and_m06s_does_not", "status": "pass", "evidence": ["cargo-test.log"]}],
 "artifacts": [{"path": "cargo-test.log", "sha256": "49d05439ebfbcbb35d6d634db1835aa7ea41a5f3e5eb060eed58056818ada127", "kind": "log"}, {"path": "m12-binding.json", "sha256": "c7c1d1f51cf855db4d3240b1eaacda9338ad5a8471ad41319f78941661d9ba9e", "kind": "json"}],
 "unknowns": [],
 "review": {"identity": "implementer: swe2-max-1/swe2-max-1 (Rally #1596 M06-B-REPIN-CORRECTED-LAYOUT, session of 2026-10-18); reviewer: Devin SWE-2/swe2-max-1 (Rally review claim of 2026-10-18 - a fresh session and context, but the same agent name as the implementer, so this round is NOT an independent review); this is the reviewer's regenerated acceptance evidence on the reviewed commit; an agent review of the code and the tests, never original-run evidence and never independent original-reference evidence; no agent review replaces the owner's human approval", "method": "acceptance suite run locally with the retail capability; the fields are derived from the recorded log, production discovery of $CS_GAME_DIR and the binding `SourceContext::read` + `SourceContext::bind` derive from it (all five critical dependencies resolved; the mission-scoped entry is carried in missions/bindings/M12.json, regenerated through production code). The task added the mission-scoped unknown mechanism to cs_content::campaign_bindings: the shared SOURCE_BINDING_UNKNOWNS stays global, and the passenger-identity verdict — the shipped data binds no passenger or extraction entity to the measured archive, measured by M06-B-FU2 — is keyed by work order. The corrected campaign layout (docs/findings/2026-10-17-m01-archive-decision.md) binds that archive, `zbd/c2/m01`, to M12, so the entry reaches M12's record alone while M06 — whose own `zbd/c1c/m01` startup fires the crew animation call_add_jack, declared by the library's passengers.zrd driving the world node apassengers — receives none, which this regeneration also asserts. The entry names the limitation, the reason and what settles it: an original reference run under M12-C or the owner's ruling. NOT CLAIMED: nothing is verified_original, no original executable was run, and the global checklist is unchanged for every other mission. Claim is implemented only; validated with tools/validate_evidence.py --require-pass. `candidate_tree` is the tree of the commit the suite and this harness ran on; the only later delta is this report's own copy under docs/findings/evidence/, which no acceptance test reads"},
 "claim": "implemented"
}
