{
 "schema_version": 1,
 "task_id": "F04-D-order-reader-members",
 "candidate_tree": "9ec81ae0cb7f43eef4a27b925cb881e9f0549f42",
 "engine": {"rust": "rustc 1.98.1 (48a229cea 2026-09-01)", "bevy": "0.19.1", "avian": "0.7.0"},
 "created_at": "2026-10-06T01:46:41Z",
 "command": {"argv": ["cargo", "test", "--workspace", "--locked", "--", "accept_f04_d_order_reader_", "--include-ignored"], "cwd": "/Users/linus/coding/rust-crimson-skies/bunny-2", "exit_code": 0},
 "source": {"install_sha256": "c14a876f4457d8710dee7986333ab636122c9549cf72b646fd69cbe7e72c5352", "content_sha256": "148a24b7b0506812e8f1ee13d8d3137a05926abebbe10161994e8c4cd300c35e"},
 "seed": 0,
 "ticks": {"start": 0, "end": 0},
 "overrides": [],
 "capabilities": ["retail", "synthetic"],
 "tests": {"discovered": 16, "executed": 16, "passed": 16, "failed": 0, "ignored": 0},
 "assertions": [{"id": "accept_f04_d_order_reader_a_mount_outside_the_reader_key_space_is_refused", "status": "pass", "evidence": ["cargo-test.log"]}, {"id": "accept_f04_d_order_reader_an_empty_archive_is_mounted_and_serves_nothing", "status": "pass", "evidence": ["cargo-test.log"]}, {"id": "accept_f04_d_order_reader_a_name_that_is_no_key_is_archived_unreachable", "status": "pass", "evidence": ["cargo-test.log"]}, {"id": "accept_f04_d_order_reader_archives_of_another_world_are_never_searched", "status": "pass", "evidence": ["cargo-test.log"]}, {"id": "accept_f04_d_order_reader_lookup_reduces_the_request_to_its_basename", "status": "pass", "evidence": ["cargo-test.log"]}, {"id": "accept_f04_d_order_reader_read_refuses_a_stale_or_foreign_resolution", "status": "pass", "evidence": ["cargo-test.log"]}, {"id": "accept_f04_d_order_reader_matches_case_insensitively_and_serves_the_first_entry", "status": "pass", "evidence": ["cargo-test.log"]}, {"id": "accept_f04_d_order_reader_a_row_that_does_not_describe_the_bytes_is_refused", "status": "pass", "evidence": ["cargo-test.log"]}, {"id": "accept_f04_d_order_reader_a_key_of_another_namespace_is_not_a_reader_lookup", "status": "pass", "evidence": ["cargo-test.log"]}, {"id": "accept_f04_d_order_reader_an_absent_name_reports_every_archive_it_searched", "status": "pass", "evidence": ["cargo-test.log"]}, {"id": "accept_f04_d_order_reader_the_designed_precedence_status_is_untouched", "status": "pass", "evidence": ["cargo-test.log"]}, {"id": "accept_f04_d_order_reader_a_skipped_archive_is_reported_and_the_next_one_serves", "status": "pass", "evidence": ["cargo-test.log"]}, {"id": "accept_f04_d_order_reader_mission_shadows_world_when_the_root_has_no_such_member", "status": "pass", "evidence": ["cargo-test.log"]}, {"id": "accept_f04_d_order_reader_root_archive_shadows_mission_and_world", "status": "pass", "evidence": ["cargo-test.log"]}, {"id": "accept_f04_d_order_reader_retail_root_player_is_served_by_its_first_entry", "status": "pass", "evidence": ["cargo-test.log"]}, {"id": "accept_f04_d_order_reader_retail_mission_shadows_world_in_five_cases", "status": "pass", "evidence": ["cargo-test.log"]}],
 "artifacts": [{"path": "cargo-test.log", "sha256": "6d280d8f434f2b7e24b7d8f0cb0cf8ad1645d5345b1792a30529d6138f29d8e5", "kind": "log"}, {"path": "reader-lookup.json", "sha256": "6ed0f48f2f52d9276888f81b40386fd5e73fc8edfc35f4e41db5577d60f8f3a5", "kind": "json"}],
 "unknowns": [],
 "review": {"identity": "bunny-2/bunny-2 (Rally #685 implement claim; no independent reviewer yet)", "method": "acceptance suite run locally with the retail capability; this harness derives every field from the recorded log, production discovery of $CS_GAME_DIR, the production reader-mount survey of all 62 declared zrdr.zbd archives, rustc and Cargo.lock. The reader lookup order (basename keys, [root, mission, world], first match wins) is read off the original executable's code, so it is `inferred`, not verified_original, and PRECEDENCE_ORDER_STATUS stays `designed`; the loose-file override, the loose directory fallback and the trailing index timestamp stay unmeasured, so the claim is only implemented"},
 "claim": "implemented"
}
