{
 "schema_version": 1,
 "task_id": "M18-A",
 "candidate_tree": "06172e3baaf1c0cb93d68a64dd8ceb735fe768ed",
 "engine": {"rust": "rustc 1.98.1 (48a229cea 2026-09-01)", "bevy": "0.19.1", "avian": "0.7.0"},
 "created_at": "2026-10-02T02:20:44Z",
 "command": {"argv": ["cargo", "test", "--workspace", "--locked", "--", "accept_m18_a_", "--include-ignored"], "cwd": "/Users/linus/coding/rust-crimson-skies/bunny-alpha-2", "exit_code": 0},
 "source": {"install_sha256": "b4e780ab84cf31d85b8452fbfcec1478137768e32d9a75ccedc4c1847c631978", "content_sha256": "a0223506e512b50c0e0445ba73204a0461e60197e28d58a7f7144632d262c12d"},
 "seed": 0,
 "ticks": {"start": 0, "end": 0},
 "overrides": [],
 "capabilities": ["retail", "synthetic"],
 "tests": {"discovered": 12, "executed": 12, "passed": 12, "failed": 0, "ignored": 0},
 "assertions": [{"id": "accept_m18_a_a_confirmed_row_outside_every_campaign_block_selects_no_position", "status": "pass", "evidence": ["cargo-test.log"]}, {"id": "accept_m18_a_a_near_miss_title_is_never_confirmed", "status": "pass", "evidence": ["cargo-test.log"]}, {"id": "accept_m18_a_a_contradicted_corroboration_establishes_no_position", "status": "pass", "evidence": ["cargo-test.log"]}, {"id": "accept_m18_a_a_title_block_must_be_exactly_the_campaign_length", "status": "pass", "evidence": ["cargo-test.log"]}, {"id": "accept_m18_a_the_committed_record_is_what_the_installation_derives", "status": "pass", "evidence": ["cargo-test.log"]}, {"id": "accept_m18_a_the_campaign_keeps_everything_else_unresolved_and_unready", "status": "pass", "evidence": ["cargo-test.log"]}, {"id": "accept_m18_a_the_position_is_interior_to_the_fourth_chapter_and_its_region_group", "status": "pass", "evidence": ["cargo-test.log"]}, {"id": "accept_m18_a_m18s_own_region_prefix_is_a_confirmed_row_that_selects_no_position", "status": "pass", "evidence": ["cargo-test.log"]}, {"id": "accept_m18_a_the_original_name_is_confirmed_against_the_local_strings", "status": "pass", "evidence": ["cargo-test.log"]}, {"id": "accept_m18_a_the_world_group_is_the_whole_chapter_and_neither_it_nor_the_mission_number_identifies_the_mission", "status": "pass", "evidence": ["cargo-test.log"]}, {"id": "accept_m18_a_the_join_is_corroborated_by_the_long_name_rows", "status": "pass", "evidence": ["cargo-test.log"]}, {"id": "accept_m18_a_source_derived_binding_has_no_unresolved_critical_dependencies", "status": "pass", "evidence": ["cargo-test.log"]}],
 "artifacts": [{"path": "cargo-test.log", "sha256": "574540433cff915d765a05f1d88b65b872aae0d79e3fdeb4d2af4af5df28db38", "kind": "log"}, {"path": "m18-binding.json", "sha256": "4d1a7a1208061849d8192c29588e663cb62516a5f0c1f3d3ed78b17356bb597e", "kind": "json"}],
 "unknowns": [],
 "review": {"identity": "implementer: bunny-alpha-2 (OpenCode, Space Bunny Alpha, Rally #309, session of 2026-10-02T01:27Z); reviewer: not yet assigned at hand-over. The implementer's own run is not independent review and is not independent original-reference evidence; no agent review replaces the owner's human approval", "method": "acceptance suite run locally with the retail capability; this harness derives every field from the recorded log, production discovery of $CS_GAME_DIR and the binding `SourceContext::read` + `SourceContext::bind` derive from it (all five critical dependencies resolved; checklist entries still unknown are recorded in missions/bindings/M18.json, not dropped). No production code changed at M18-A: the join, its corroboration, the two display-form confirmation and the guard are M02-A's and M05-A's, and this stage exercises them at the eighteenth campaign position — the third mission of chapter 4, strictly interior to the layout's chapter group and to the localized long names' fourth region group, whose world group c4 is the whole chapter and whose mission number 3 names a mission in every chapter. What M18-A adds is the refusal arm no earlier stage reached on real data: a *confirmed* localized row that names no campaign position, exercised on M18's own region prefix, with the same production predicate (`campaign_position_for`, `JoinAgreement::establishes`) proved on authored values in the synthetic tests so CI runs it. The implementer applied seven mutations to `crates/cs_content/src/campaign_bindings.rs` — dropping the short-row-block refusal, suppressing the verbatim confirmation form, neutering the `establishes()` guard, removing the campaign-length block filter, relaxing `is_verified`, shifting the campaign position by one, and making `title_form`'s tail comparison a prefix match — and every one was caught; the last was initially missed and closed by adding `accept_m18_a_a_near_miss_title_is_never_confirmed`. Claim is implemented only; validated with tools/validate_evidence.py --require-pass"},
 "claim": "implemented"
}
