{
 "schema_version": 1,
 "task_id": "T452",
 "candidate_tree": "e6a4c9945d63e2f7730fdd7e6f4baca94c6bde39",
 "engine": {"rust": "rustc 1.98.1 (48a229cea 2026-09-01)", "bevy": "0.20.0", "avian": "0.8.0"},
 "created_at": "2026-10-27T21:41:46Z",
 "command": {"argv": ["cargo", "test", "-p", "cs_app", "--test", "cs_app_tests_a", "--locked", "--", "accept_t452_", "--include-ignored"], "cwd": "/Users/linus/coding/rust-crimson-skies/deepseek-1", "exit_code": 0},
 "source": {"install_sha256": "b4e780ab84cf31d85b8452fbfcec1478137768e32d9a75ccedc4c1847c631978", "content_sha256": "a0223506e512b50c0e0445ba73204a0461e60197e28d58a7f7144632d262c12d"},
 "seed": 0,
 "ticks": {"start": 0, "end": 0},
 "overrides": [],
 "capabilities": ["retail", "synthetic"],
 "tests": {"discovered": 14, "executed": 14, "passed": 14, "failed": 0, "ignored": 0},
 "assertions": [{"id": "accept_t452_a_catalogued_entry_refuses_a_family_contradiction", "status": "pass", "evidence": ["cargo-test.log", "original-catalogue.json"]}, {"id": "accept_t452_a_proximity_fuse_keeps_the_measured_shape_and_sampling", "status": "pass", "evidence": ["cargo-test.log", "original-catalogue.json"]}, {"id": "accept_t452_a_guided_entry_names_its_lost_target_rule_or_its_claim", "status": "pass", "evidence": ["cargo-test.log", "original-catalogue.json"]}, {"id": "accept_t452_a_timed_fuse_keeps_the_records_seconds_and_no_tick_count", "status": "pass", "evidence": ["cargo-test.log", "original-catalogue.json"]}, {"id": "accept_t452_an_unmeasured_mount_is_a_claim_not_a_default_slot", "status": "pass", "evidence": ["cargo-test.log", "original-catalogue.json"]}, {"id": "accept_t452_the_nitro_record_carries_the_measured_rule_and_its_vocabulary_gap", "status": "pass", "evidence": ["cargo-test.log", "original-catalogue.json"]}, {"id": "accept_t452_an_uncatalogued_id_is_reported_missing", "status": "pass", "evidence": ["cargo-test.log", "original-catalogue.json"]}, {"id": "accept_t452_the_start_of_step_fuse_misses_a_crossing_inside_a_step", "status": "pass", "evidence": ["cargo-test.log", "original-catalogue.json"]}, {"id": "accept_t452_every_declared_id_is_queryable_in_the_registry", "status": "pass", "evidence": ["cargo-test.log", "original-catalogue.json"]}, {"id": "accept_t452_retail_every_entry_names_the_values_it_does_not_measure", "status": "pass", "evidence": ["cargo-test.log", "original-catalogue.json"]}, {"id": "accept_t452_retail_each_fuse_is_the_records_own_trigger", "status": "pass", "evidence": ["cargo-test.log", "original-catalogue.json"]}, {"id": "accept_t452_retail_the_nitro_record_is_the_measured_one", "status": "pass", "evidence": ["cargo-test.log", "original-catalogue.json"]}, {"id": "accept_t452_retail_every_declared_component_id_resolves_in_the_registry", "status": "pass", "evidence": ["cargo-test.log", "original-catalogue.json"]}, {"id": "accept_t452_retail_the_projectile_component_type_is_still_the_runtime_one", "status": "pass", "evidence": ["cargo-test.log", "original-catalogue.json"]}],
 "artifacts": [{"path": "cargo-test.log", "sha256": "a1fbd3207e193c10942e4e1bc4f44d74f0c2df3ab1f3bc5bfb59817609582280", "kind": "log"}, {"path": "original-catalogue.json", "sha256": "661b7ad966cc28b7dd9752e3b3d1b92748fb80faafa44c5672da5ce1946ee4f2", "kind": "json"}],
 "unknowns": [],
 "review": {"identity": "deepseek-1/deepseek-1 (implementer; hands the branch over without reviewing its own work)", "method": "Acceptance suite run locally with the retail capability (CS_GAME_DIR set, CS_CAPABILITIES=retail,gpu,audio); this report is derived from the recorded log plus a second production pass recorded in original-catalogue.json. MEASURED (identifiers, numbers, counts and digests only, no original display text, no script text): every weapon record T452.01's stated rules classify - sixteen in all: twelve guided rockets, two area-denial components, one aerial torpedo and one proximity flak - read through cs_content::ordnance::read_original_component_table and read_original_rocket_blasts, catalogued by cs_app::ordnance::read_original_catalogue and inserted with cs_app::ordnance::catalogue_measured_ordnance into a real cs_sim::weapons::OrdnanceRegistry, where every one of the sixteen ids resolves with a family, a mount, a guidance rule, a fuse and an arming rule; the thirty-two records no family rule reaches (the thirty-one CANNON machine and turret guns and the cannonball wep_28) are listed by name and never folded into a family. Per component the catalogue keeps only what the files state: the family from the record's keys; the mount as one of the eight rocket slots (the glidebomb wep_25 declares LOCK_ON and no ROCKET flag, so its mount is a named unknown, not an assumed slot); guidance Unguided or Targeted, with the measured lost-target rule coast-then-detonate-at-end-of-RANGE for every guided record task #454 measured, and a named unknown for wep_25 which that measurement does not cover; the fuse as the record's own DETONATION_DISTANCE sphere (shape sphere, boundary inclusive) sampled the way task T452.02 statically measured the engine to sample it - once per step at the item's start-of-step position, not the swept relative-path model - or the record's stated DETONATION_TIME duration in seconds (wep_15, 2 s), or a named unknown where the record states no trigger at all (the smoke record wep_13 and the flak record wep_26, whose only stated radius is its IMPACT_PROXIMITY blast radius, not a trigger); arming on release, the measured rule, because T452.02 found no arming condition on the proximity path other than the fuse's own live conditions and RANGE_MINIMUM gates impact detonations only. The nitro booster is not a wep_ record - no record, no id - so it is recorded as actor state: the header's MPOUT_CHK_NITRO control, capacity 30.0, consumption 4.0 per engine delta, recovery 1.0 per delta on every step, a start at 99% of capacity and a cut below 5%, and the measured 1.8 engine-value replacement and 0.8 result factor. NOT CLAIMED: any original-run behavior (retail is read access and no agent ran the original executable); any statement that the original's rockets fly at the recorded VELOCITY, live for any duration, apply any status effect or mount in the recorded slot. What each catalogued component still does not measure is named per entry by claim id and field rather than defaulted: t452_04.limit.velocity_unit (the VELOCITY unit, fifteen records), t452_04.limit.release_delay (what FIRE_RATE delays and in which direction, sixteen records), t452_04.limit.no_expires_key (the member carries no EXPIRES key at all, fifteen records), t452_04.limit.area_lifetime (fifteen records), t452_04.limit.area_radius (the two area-denial records), t452_04.limit.status_effect_kind (seven records) and t452_04.limit.status_effect_duration (four records), t452_04.limit.rocket_flag_missing (wep_25's slot), t454.limit.swarm (the eleven clustered records), t452.limit.fuse (wep_13 and wep_26), t452.limit.lost_target (wep_25), t452.limit.nitro_activation_rule (the measured charge-bounded rule has no NitroActivationRule variant, so it is recorded and not lowered to a rule it is not; resolving task #452 follow-up), t452.limit.nitro_tradeoff (the measured 1.8 replaces an engine-record value, so no newtons and no authority multiplier are asserted), and t452.limit.runtime_lowering (every entry: the record states no stack capacity or unit mass, no media keys and no equipment rules, so a runtime component would fabricate all three - the entries are catalogued, and no original id is registered as flyable). The claim is implemented: a code and test pass awards nothing above that, and no agent review replaces the owner's human approval. Validated with tools/validate_evidence.py --require-pass."},
 "claim": "implemented"
}
