{
 "schema_version": 1,
 "task_id": "T692",
 "candidate_tree": "e42debeff1ad5e4be21a6b4b7caa621a4c896e8e",
 "engine": {"rust": "rustc 1.98.1 (48a229cea 2026-09-01)", "bevy": "0.19.1", "avian": "0.7.0"},
 "created_at": "2026-10-06T08:54:47Z",
 "command": {"argv": ["cargo", "test", "--workspace", "--locked", "--", "accept_t692_", "--include-ignored"], "cwd": "/Users/linus/coding/rust-crimson-skies/swe2-max-1", "exit_code": 0},
 "source": {"install_sha256": "c14a876f4457d8710dee7986333ab636122c9549cf72b646fd69cbe7e72c5352", "content_sha256": "148a24b7b0506812e8f1ee13d8d3137a05926abebbe10161994e8c4cd300c35e"},
 "seed": 0,
 "ticks": {"start": 0, "end": 0},
 "overrides": [],
 "capabilities": ["retail", "synthetic"],
 "tests": {"discovered": 3, "executed": 3, "passed": 3, "failed": 0, "ignored": 0},
 "assertions": [{"id": "accept_t692_tail_accessors_read_the_measured_subfields", "status": "pass", "evidence": ["cargo-test.log"]}, {"id": "accept_t692_retail_word_distribution_is_family_and_codec_shaped", "status": "pass", "evidence": ["cargo-test.log"]}, {"id": "accept_t692_retail_every_index_entry_tail_has_the_measured_shape", "status": "pass", "evidence": ["cargo-test.log"]}],
 "artifacts": [{"path": "cargo-test.log", "sha256": "d265cb8d31289570e66bcda6a75810d46ce9e584145519ce289826272ae04ed0", "kind": "log"}, {"path": "zbd-index-tail.json", "sha256": "40833fd49f2f33a26d611dee08c4785708b15bd4c8e23fd0d34dd0899c491378", "kind": "json"}],
 "unknowns": ["What the u32 `flags` slot of a version-one index entry encodes is not established: `2` on every reader entry, `62` on `soundsh` and most of `soundsl`, correlated with the sound members' WAVE codecs, but the original engine never reads the field and no source names the values. Affected content: every one of the 6,334 index entries in the 64 retail archives indexed by a version-one trailer.", "The 555 increasing word values on `soundsl.zbd`'s IMA-ADPCM members (29,688,754 .. 30,092,802, all ≡ 2 mod 4) match no member offset, gap or record measured anywhere; the archiver documentation's unzeroed-memory warning is the most consistent account, but the values' meaning stays unknown. Affected content: those 555 soundsl members' flag words.", "Whether the `time` stamp is ever compared by the original engine is settled negatively for the loose-override path (it compares the archive file's own last-write time), but whether some unmeasured original path reads `flags`, `comment` or `time` cannot be excluded by static analysis alone. Affected content: runtime semantics of all three fields, which production therefore keeps labelled `unknown`."],
 "review": {"identity": "implementer: swe2-max-1 (Rally #692 implement claim); reviewer: recorded by the reviewing agent — no review had happened when this report was generated", "method": "acceptance suite run locally with the retail capability; this harness derives every field from the recorded log, production discovery of $CS_GAME_DIR, the production index reader and sound reader plus read_wave_header over every retail sound and reader archive (zbd-index-tail.json), rustc and Cargo.lock. The three `unknowns` are the task's honest residue: the flag word's semantics, the soundsl series' meaning, and any unmeasured original reader of the fields; so the report must be validated WITHOUT --require-pass, which would reject unresolved issues. The claim is `implemented`, never `verified_original` or `release_approved`"},
 "claim": "implemented"
}
