{
 "schema_version": 1,
 "task_id": "F39-E7",
 "candidate_tree": "bd13989c347871e715424d4f2f89683761810651",
 "engine": {"rust": "rustc 1.98.1 (48a229cea 2026-09-01)", "bevy": "0.19.1", "avian": "0.7.0"},
 "created_at": "2026-10-04T02:28:17Z",
 "command": {"argv": ["cargo", "test", "--workspace", "--locked", "--", "accept_f39_e7_", "--include-ignored"], "cwd": "/Users/linus/coding/rust-crimson-skies/bunny-alpha-1", "exit_code": 0},
 "source": {"install_sha256": "b4e780ab84cf31d85b8452fbfcec1478137768e32d9a75ccedc4c1847c631978", "content_sha256": "a0223506e512b50c0e0445ba73204a0461e60197e28d58a7f7144632d262c12d"},
 "seed": 0,
 "ticks": {"start": 0, "end": 0},
 "overrides": [],
 "capabilities": ["retail", "synthetic"],
 "tests": {"discovered": 7, "executed": 7, "passed": 7, "failed": 0, "ignored": 0},
 "assertions": [{"id": "accept_f39_e7_the_producer_column_is_the_inverse_of_the_only_counting_path", "status": "pass", "evidence": ["cargo-test.log", "detached-vocabulary-census.json"]}, {"id": "accept_f39_e7_a_detached_actor_is_represented_by_a_release_that_keeps_its_objective", "status": "pass", "evidence": ["cargo-test.log", "detached-vocabulary-census.json"]}, {"id": "accept_f39_e7_the_six_distinctions_resolve_in_the_contract_s_own_order", "status": "pass", "evidence": ["cargo-test.log", "detached-vocabulary-census.json"]}, {"id": "accept_f39_e7_each_distinction_names_a_vocabulary_entry_and_a_producer_or_a_named_reason", "status": "pass", "evidence": ["cargo-test.log", "detached-vocabulary-census.json"]}, {"id": "accept_f39_e7_the_spelling_rule_is_a_segment_match_over_a_published_stem_list", "status": "pass", "evidence": ["cargo-test.log", "detached-vocabulary-census.json"]}, {"id": "accept_f39_e7_the_reader_keeps_the_three_surfaces_apart", "status": "pass", "evidence": ["cargo-test.log", "detached-vocabulary-census.json"]}, {"id": "accept_f39_e7_the_installation_spell_no_detached_category_on_either_counting_surface", "status": "pass", "evidence": ["cargo-test.log", "detached-vocabulary-census.json"]}],
 "artifacts": [{"path": "cargo-test.log", "sha256": "4dc077a3d59112306c1807c3e3b9155219b805437ca7fabeaa390b4435c03b9b", "kind": "log"}, {"path": "detached-vocabulary-census.json", "sha256": "476eb5415d364c74882b8cbdfcac0f9af01518dbbf41db6a7074183312e5b8d0", "kind": "json"}],
 "unknowns": [],
 "review": {"identity": "bunny-alpha-1/bunny-alpha-1 (review pass over its own implementer branch; not independent): all four checks re-run on the tree rebased over main's F54-X1, the census re-derived by a second production run, and the assertion evidence names derived from the report's own artifacts after the review found them pointing at F39-E1's file", "method": "Acceptance suite run locally with the retail capability; this harness derives every field from the recorded log, production discovery of $CS_GAME_DIR, and a second production run of cs_app::objectives::survey_retail_detached_declarations over the installation (detached-vocabulary-census.json). Claim is implemented only. MEASURED: every reader archive in the installation was opened, its objectives.zrd member decoded with the production .zrd reader and read through cs_content::objectives::measure_detached_vocabulary; over 62 archives (53 mission-scoped and 9 shared/world-group, the denominator F39-D's census did not have) the installation declares 3244 counted-condition names (191 distinct), 758 objective-kind names (170 distinct) and 3523 block-declaration names (1284 distinct). VERDICT detached_is_an_event_not_a_counted_category: 0 sites on either surface that could declare a category spell the contract's own DETACH stem, and 0 spell any other stem of the published twelve-stem family except the 1 objective kind(s) and 24 block declaration(s) listed in the census artifact; every one of the 7 DROP sites is a block declaration of an OBJECTIVE<N> block, never a counted condition. WHERE A DETACHED ACTOR IS REPRESENTED INSTEAD: the release/attach path, which keeps objective identity rather than ending the actor's life (cs_sim::world_actors::release::release_payload carries objective: Option<SymbolId> across the release; cs_content::animation::AttachmentOp::Detach is the authored op), and the lifecycle transition that leaves mission accounting without counting anything is LifecycleKind::MissionRemoved, which cs_sim::objectives::counters::CountKind::from_lifecycle answers None for. LIMITS OF WHAT WAS MEASURED: (1) the negative is a measured absence of the SPELLING over a published twelve-stem segment-prefix list, not a proof that the original has no notion of a detached actor - a name spelled outside those stems would not be found; (2) the compiled mission program behind each record is not decoded at all, because the mission-language instruction table is unmeasured (F13-B/C, F38 own it); (3) what satisfying an INACTIVE<n> condition means is unmeasured (F39-E1), so even a name that had spelled a category here would not have been a readable rule; (4) no original executable was run, so nothing here is evidence of how the original behaves, only of what its files declare; (5) whether an original RECORD may declare one of the five counted categories is decided in one place, cs_content::objectives::original_count_category_refusal (F39-E4), and this task neither restates nor widens that census; (6) no engine path writes an ActorState, ActorState::Detached included: Condition::ActorIs reads MissionFacts::actors, which the simulation's caller supplies and which every caller in this repository passes empty, so the sixth's condition half is expressible but not yet observable, for all six alike, and F37's mission runtime with F38's adapters own populating it. `unknowns` is empty because every unresolved item above is a limit on the claim rather than an unresolved measurement: every row of the census resolved. Validated with tools/validate_evidence.py --require-pass."},
 "claim": "implemented"
}
