{
 "schema_version": 1,
 "task_id": "M16-A",
 "candidate_tree": "9e8e1b6e659b404073e8cfa58637390f453941fb",
 "engine": {"rust": "rustc 1.98.1 (48a229cea 2026-09-01)", "bevy": "0.19.1", "avian": "0.7.0"},
 "created_at": "2026-10-02T01:19:43Z",
 "command": {"argv": ["cargo", "test", "--workspace", "--locked", "--", "accept_m16_a_", "--include-ignored"], "cwd": "/Users/linus/coding/rust-crimson-skies/bunny-alpha-1", "exit_code": 0},
 "source": {"install_sha256": "b4e780ab84cf31d85b8452fbfcec1478137768e32d9a75ccedc4c1847c631978", "content_sha256": "a0223506e512b50c0e0445ba73204a0461e60197e28d58a7f7144632d262c12d"},
 "seed": 0,
 "ticks": {"start": 0, "end": 0},
 "overrides": [],
 "capabilities": ["retail", "synthetic"],
 "tests": {"discovered": 9, "executed": 9, "passed": 9, "failed": 0, "ignored": 0},
 "assertions": [{"id": "accept_m16_a_a_title_block_must_be_exactly_the_campaign_length", "status": "pass", "evidence": ["cargo-test.log"]}, {"id": "accept_m16_a_a_contradicted_corroboration_establishes_no_position", "status": "pass", "evidence": ["cargo-test.log"]}, {"id": "accept_m16_a_the_campaign_keeps_everything_else_unresolved_and_unready", "status": "pass", "evidence": ["cargo-test.log"]}, {"id": "accept_m16_a_the_committed_record_is_what_the_installation_derives", "status": "pass", "evidence": ["cargo-test.log"]}, {"id": "accept_m16_a_the_position_is_the_first_row_of_the_fourth_chapter_and_region_group", "status": "pass", "evidence": ["cargo-test.log"]}, {"id": "accept_m16_a_the_original_name_is_confirmed_against_the_local_strings", "status": "pass", "evidence": ["cargo-test.log"]}, {"id": "accept_m16_a_the_world_group_is_the_whole_chapter_and_not_the_mission", "status": "pass", "evidence": ["cargo-test.log"]}, {"id": "accept_m16_a_the_join_is_corroborated_by_the_long_name_rows", "status": "pass", "evidence": ["cargo-test.log"]}, {"id": "accept_m16_a_source_derived_binding_has_no_unresolved_critical_dependencies", "status": "pass", "evidence": ["cargo-test.log"]}],
 "artifacts": [{"path": "cargo-test.log", "sha256": "6b165610a18974d7068895f21282c335b57822473fce32cbe25698f73ed19cb4", "kind": "log"}, {"path": "m16-binding.json", "sha256": "427702db3651d47829df57ade0ba1e1d93bc18c4be953c5f1c14f4d32788a4a0", "kind": "json"}],
 "unknowns": [],
 "review": {"identity": "implementer: claude-2/claude-1 (Rally #303, Claude Sonnet 5.5, session of 2026-10-02T00:23Z); reviewer: bunny-alpha-1/bunny-alpha-1 (OpenCode, Space Bunny Alpha, review claim of 2026-10-02T00:58Z, fresh context and a different agent instance from the implementer's). An agent review is not independent original-reference evidence and no agent review replaces the owner's human approval", "method": "acceptance suite run locally with the retail capability by the implementer and re-run by the reviewer on the commit below, each test also executed alone with `--exact`; this harness derives every field from the recorded log, production discovery of $CS_GAME_DIR and the binding `SourceContext::read` + `SourceContext::bind` derive from it (all five critical dependencies resolved; checklist entries still unknown are recorded in missions/bindings/M16.json, not dropped). No production code changed at M16-A: the join, its corroboration and the guard are M02-A's, and this stage exercises them at the sixteenth campaign position, the first mission of chapter 4 and the first row of the localized long names' fourth region group, whose world group c4 is the whole chapter. The reviewer re-derived the retail facts independently of the binding code (the ZBD chapter/mission directory layout and the UTF-16 region-prefixed long-name rows of langui.dll, group sizes 5/5/5/5/4) and corrected a stale M06-A comment, a weak `entry.chapter > 3` bound and this report's own reviewer identity; see docs/findings/2026-10-02-m16-a-source-binding.md. Claim is implemented only; validated with tools/validate_evidence.py --require-pass. `candidate_tree` is the tree of the commit the suite ran on: the only later delta is this report's own copy under docs/findings/evidence/, whose bytes are this file"},
 "claim": "implemented"
}
