{
 "schema_version": 1,
 "task_id": "F11-D2.1",
 "candidate_tree": "ff90a5c5fc16b30f87d4fd9ded9e09165278f5f1",
 "engine": {"rust": "rustc 1.98.1 (48a229cea 2026-09-01)", "bevy": "0.19.1", "avian": "0.7.0"},
 "created_at": "2026-10-05T07:47:53Z",
 "command": {"argv": ["cargo", "test", "--workspace", "--locked", "--", "accept_f11_d2p1_", "--include-ignored"], "cwd": "/Users/linus/coding/rust-crimson-skies/sonnet-2", "exit_code": 0},
 "source": {"install_sha256": "b4e780ab84cf31d85b8452fbfcec1478137768e32d9a75ccedc4c1847c631978", "content_sha256": "a0223506e512b50c0e0445ba73204a0461e60197e28d58a7f7144632d262c12d"},
 "seed": 0,
 "ticks": {"start": 0, "end": 0},
 "overrides": [],
 "capabilities": ["retail", "synthetic"],
 "tests": {"discovered": 3, "executed": 3, "passed": 3, "failed": 0, "ignored": 0},
 "assertions": [{"id": "accept_f11_d2p1_a_load_line_is_not_an_airframe_declaration", "status": "pass", "evidence": ["cargo-test.log"]}, {"id": "accept_f11_d2p1_an_ambiguous_script_is_a_finding_and_the_unknown_stands", "status": "pass", "evidence": ["cargo-test.log"]}, {"id": "accept_f11_d2p1_retail_the_chapter_loads_declare_no_airframe", "status": "pass", "evidence": ["cargo-test.log"]}],
 "artifacts": [{"path": "cargo-test.log", "sha256": "10f46353b884d48e6bc6040914124dd85bb228e6bcbea74b7d52aa47daf321cc", "kind": "log"}, {"path": "mission-only-discovery.json", "sha256": "08efff65ab83337f064830fa98d2a3f47580711ce98f769cec39f27e928f6ef7", "kind": "json"}],
 "unknowns": [],
 "review": {"identity": "implementer: sonnet-2 (Rally #500); review pending, so no independent review is claimed and nothing is raised above `checked`", "method": "reviewer: sonnet-2 (Rally #500 review); SAME agent instance as the implementer, so NOT independent and context not fresh; nothing raised above checked. Method: rebased on origin/main, reran fmt, clippy, full workspace tests and the retail task-prefix tests, regenerated this report on the rebased tree."},
 "claim": "implemented"
}
