{
 "schema_version": 1,
 "task_id": "F45-B.1",
 "candidate_tree": "5dcd26a63937a3e1e83fe4e16e6e6b3854d3876c",
 "engine": {"rust": "rustc 1.98.1 (48a229cea 2026-09-01)", "bevy": "0.19.1", "avian": "0.7.0"},
 "created_at": "2026-10-15T04:02:52Z",
 "command": {"argv": ["cargo", "test", "-p", "cs_app", "--test", "ui", "--locked", "--", "accept_f45_b_1_", "--include-ignored"], "cwd": "/Users/linus/coding/rust-crimson-skies/agent-4", "exit_code": 0},
 "source": {"install_sha256": "b4e780ab84cf31d85b8452fbfcec1478137768e32d9a75ccedc4c1847c631978", "content_sha256": "a0223506e512b50c0e0445ba73204a0461e60197e28d58a7f7144632d262c12d"},
 "seed": 0,
 "ticks": {"start": 0, "end": 0},
 "overrides": [],
 "capabilities": ["retail", "synthetic"],
 "tests": {"discovered": 6, "executed": 6, "passed": 6, "failed": 0, "ignored": 0},
 "assertions": [{"id": "accept_f45_b_1_art_that_is_missing_ambiguous_or_unreadable_is_refused_not_chosen", "status": "pass", "evidence": ["cargo-test.log", "front-end-screens.json"]}, {"id": "accept_f45_b_1_the_parser_reads_sections_variables_and_keeps_unresolved_placeholders", "status": "pass", "evidence": ["cargo-test.log", "front-end-screens.json"]}, {"id": "accept_f45_b_1_a_button_is_bound_only_through_the_script_it_starts", "status": "pass", "evidence": ["cargo-test.log", "front-end-screens.json"]}, {"id": "accept_f45_b_1_the_deck_refuses_a_screen_whose_original_buttons_the_table_cannot_all_bind", "status": "pass", "evidence": ["cargo-test.log", "front-end-screens.json"]}, {"id": "accept_f45_b_1_a_screen_that_the_table_fully_covers_enters_the_deck", "status": "pass", "evidence": ["cargo-test.log", "front-end-screens.json"]}, {"id": "accept_f45_b_1_retail_the_original_layout_is_read_and_each_screen_is_built_or_refused_by_name", "status": "pass", "evidence": ["cargo-test.log", "front-end-screens.json"]}],
 "artifacts": [{"path": "cargo-test.log", "sha256": "3cfc5742324cab95f59de8cb3e4cdce292011a82a09ad29ee099f00bf2638c3e", "kind": "log"}, {"path": "original-layout.json", "sha256": "c31558262359521baf0eb56f3b319e05b53170afb110a715a493924de15d8d4f", "kind": "json"}],
 "unknowns": ["original focus/tab order: no column of LAYOUT.CSV carries it (the header's TabOrder column is absent from every data row); focus stays the declared order. Gates any keyboard/controller-focus fidelity claim.", "handlers of the buttons that start no screen script (NoScript, e.g. quit, fly mission, return to briefing): they live in ASSETS/SCRIPTS/*.SCRIPT, not read here. Gates 'every visible original button works'.", "MainMenu and Settings have no screen-sized pane at the origin (their backdrop is a movie row / the menu behind): refused NoFullPane, no art bound.", "Cabin, FlightCheck and Construction are refused by the deck (HiddenAction / NoEscapeButton): the designed state table and the original screens do not match. Gates any claim that the designed front end reproduces the original screen set.", "original screens with no designed counterpart (Campaign, Instant Action, Multiplayer, Credits, Save/Load, Momento selection, Plane name/selection, Ordinance layout) are unpaired and unread.", "BUTTON_STATE_FRAMES=4 is read from the art; PC_B_PreviousMissions.png (height 129) has an unknown frame count and is refused.", "the pairing of original sections with designed screens (SCREEN_SECTIONS) is a name-based design choice awaiting owner review.", "no original executable run: retail is read access only; nothing is verified_original."],
 "review": {"identity": "Implementer: claude-2 (claude-sonnet-5-5, Rally #742 implement claim of 2026-10-15). Reviewer: recorded by the reviewer in the complete_review notes; this report was written by the implementer, so it is not independent evidence, and no agent review replaces the owner's human approval.", "method": "the acceptance suite re-run locally with `CS_GAME_DIR` set, every `accept_f45_b_1_*` test selected by prefix with `--include-ignored`; every field is derived from the recorded log, production discovery of $CS_GAME_DIR and the layout artifact the retail test derived with the production reader (`cs_app::ui::front_end::OriginalLayout` over `FrontEndScreens`, `cs_assets::rof::mount_rof_into` for GOSDATA/ASSETS/crimson.rof); the artifact is checked against this report's install hash before it is referenced. `unknowns` are the product limitations of docs/findings/2026-10-15-f45-b-1-original-layout.md and gate fidelity claims. `claim` is `implemented` only: `retail` means read access to the owner's files, not an original run."},
 "claim": "implemented"
}
