{
 "schema_version": 1,
 "task_id": "M01-LC-DIRECTIVE-LOWERING",
 "candidate_tree": "c14259c2aafd3464875eb45868cc716bda22c34a",
 "engine": {"rust": "rustc 1.98.1 (48a229cea 2026-09-01)", "bevy": "0.19.1", "avian": "0.7.0"},
 "created_at": "2026-10-09T14:37:48Z",
 "command": {"argv": ["cargo", "test", "--workspace", "--locked", "--", "accept_m01_lc_lowering_adapter_", "accept_m01_lc_directive_lowering_", "--include-ignored"], "cwd": "/Users/linus/coding/rust-crimson-skies/bunny-alpha-2", "exit_code": 0},
 "source": {"install_sha256": "b4e780ab84cf31d85b8452fbfcec1478137768e32d9a75ccedc4c1847c631978", "content_sha256": "a0223506e512b50c0e0445ba73204a0461e60197e28d58a7f7144632d262c12d"},
 "seed": 0,
 "ticks": {"start": 0, "end": 0},
 "overrides": [],
 "capabilities": ["retail", "synthetic"],
 "tests": {"discovered": 14, "executed": 14, "passed": 14, "failed": 0, "ignored": 0},
 "assertions": [{"id": "accept_m01_lc_directive_lowering_a_lowered_record_runs_to_a_terminal_outcome", "status": "pass", "evidence": ["cargo-test.log", "m01-directive-lowering.json"]}, {"id": "accept_m01_lc_directive_lowering_m01_lowers_launches_and_steps_in_the_runtime", "status": "pass", "evidence": ["cargo-test.log", "m01-directive-lowering.json"]}, {"id": "accept_m01_lc_lowering_adapter_an_empty_record_stays_unmet", "status": "pass", "evidence": ["cargo-test.log", "m01-directive-lowering.json"]}, {"id": "accept_m01_lc_lowering_adapter_a_measured_record_lowers_and_reports_complete", "status": "pass", "evidence": ["cargo-test.log", "m01-directive-lowering.json"]}, {"id": "accept_m01_lc_lowering_adapter_a_missing_mission_id_produces_no_program", "status": "pass", "evidence": ["cargo-test.log", "m01-directive-lowering.json"]}, {"id": "accept_m01_lc_lowering_adapter_an_unreadable_block_is_carried_as_a_refusal", "status": "pass", "evidence": ["cargo-test.log", "m01-directive-lowering.json"]}, {"id": "accept_m01_lc_lowering_adapter_an_unmeasured_key_refuses_its_sites_by_name", "status": "pass", "evidence": ["cargo-test.log", "m01-directive-lowering.json"]}, {"id": "accept_m01_lc_lowering_adapter_a_scalar_site_is_refused_and_damages_its_block", "status": "pass", "evidence": ["cargo-test.log", "m01-directive-lowering.json"]}, {"id": "accept_m01_lc_lowering_adapter_a_nested_argument_stays_nested_through_the_bound_call", "status": "pass", "evidence": ["cargo-test.log", "m01-directive-lowering.json"]}, {"id": "accept_m01_lc_lowering_adapter_a_block_the_condition_lowering_refuses_stays_unmet", "status": "pass", "evidence": ["cargo-test.log", "m01-directive-lowering.json"]}, {"id": "accept_m01_lc_lowering_adapter_the_rows_report_the_attempt_not_the_vocabulary", "status": "pass", "evidence": ["cargo-test.log", "m01-directive-lowering.json"]}, {"id": "accept_m01_lc_lowering_adapter_the_census_reports_complete_rows_and_keeps_the_gate", "status": "pass", "evidence": ["cargo-test.log", "m01-directive-lowering.json"]}, {"id": "accept_m01_lc_lowering_adapter_every_key_is_bound_and_both_vocabulary_tables_agree", "status": "pass", "evidence": ["cargo-test.log", "m01-directive-lowering.json"]}, {"id": "accept_m01_lc_lowering_adapter_m01_lowers_into_a_validated_raw_program", "status": "pass", "evidence": ["cargo-test.log", "m01-directive-lowering.json"]}],
 "artifacts": [{"path": "cargo-test.log", "sha256": "64053160c5e8a8cdd214be356061cc3258dc4d2c14cfe32d3ef3878b136fd911", "kind": "log"}, {"path": "m01-directive-lowering.json", "sha256": "a67b493bb096765dbe0eeec58d9e4a544cf339c1348f36052a29cab89e67a99f", "kind": "json"}],
 "unknowns": [],
 "review": {"identity": "reviewer bunny-alpha-1 (original #717 review, context limited to the Rally task history, the submitted summary and the branch diff; same agent identity as the implementer, so NOT independent evidence). Report regenerated 2026-10-08 by bunny-alpha-1 as implementer of M01-LC-WORLD-FACTS (#751) after that task landed the world-side MissionFacts writers: review.method now names #751 as resolving the world-side fact limit instead of carrying it as an open gate, and this run's artifacts come from this checkout alone (per-worktree target dir, so the accept_t383 gate passes). Independent review of this regenerated report is still preferred: Rally does not enforce reviewer assignment (owner directive 2026-09-28), and no agent review replaces the owner's human approval. | Regeneration for Rally #804 on 2026-10-09 by bunny-alpha-2/bunny-alpha-2: this task's evidence sequence was re-run on the post-#798 tree (the engine image is no longer part of the installation inventory); source.install_sha256/content_sha256 were re-measured there, the run facts (candidate_tree, created_at, command.cwd, artifacts, assertion order) and every number the harness re-derives (review.method included) are this run's own rather than carried over from the old report; the implementer and reviewer claims recorded above stand as they were written.", "method": "Acceptance suite run locally with the retail capability; this harness derives every field from the recorded log, production discovery of $CS_GAME_DIR, and a second production run of cs_app::mission_control::survey_mission_control_programs over the installation (m01-directive-lowering.json). Claim is implemented only. MEASURED: M01's control record now lowers into a RawProgram the adapter assembles from the record itself - 58 numbered block(s) became 58 RawObjective(s) each carrying one lowered condition (58 condition verdict(s)), 353 directive site(s) became 353 RawCall(s) each bound through 43 registry binding(s) built from the record's own key dispositions, and MissionProgram::validate reports true. The vocabulary partitions into 41 measured key(s) bound to their DirectiveOperation and 2 terminal outcome key(s) bound to Lowering::Finish, with 0 key(s) left unmeasured over the whole of M01's 43 distinct keys - so the mission_identity, objective_identity, objective_condition and call_arguments rows are all met from the attempt, is_complete() is true for zbd/c1c/m01, complete_missions() reports 7 of the 40 measured row(s) over 53 mission-scoped reader(s), and campaign_ready() is false while 13 reader(s) declare no control program at all and the corpus still spells keys no finding covers (79 unmet lowering row(s) corpus-wide). A bound call emits Action::Directive for the host: that is the emission of the measured operation, NOT evidence that a world-side handler exists, so measured stays unimplemented and only the two outcome spellings reach an engine operation. LIMITS OF WHAT WAS MEASURED: this is a static lowering of the record into the IR - no original program was run and no mission was played, so nothing here is verified_original behaviour, and the residual unknowns the stage A-D findings recorded stay named on the rows and keys that carry them. FAIL-CLOSED WITNESSES: an unmeasured key, a block the condition lowering refused, a scalar beside its key, an unreadable block, an empty record and a record whose attempt produced no program all still refuse by name with their rows unmet. WORLD-SIDE FACT WRITERS: MissionFacts::members/groups/generators/animations now have production writers (cs_app::world_facts, folded before the tick by compose_mission_facts), so the 24 of M01's 58 blocks - the 12 carrying Condition::InactiveMembers (the INACTIVE ladders), the 8 carrying Condition::EnemyGroupDepletion, the 1 carrying Condition::Travelers and the 3 carrying Condition::AnimationStates - are no longer permanently blocked: task M01-LC-WORLD-FACTS (#751) resolved the limit this report used to carry, and its acceptance accept_m01_lc_world_facts_ drives one INACTIVE block to completion on observed world state and to non-completion while the world still holds the member in play, with every chain, group id and animation name the record spells resolved into the right map and an unresolvable chain recorded absent. What a host still has to observe before each of them can complete - member in-play state, group living counts, the TRAVELERS subject's position and animation state bytes - is named in docs/findings/2026-10-08-m01-lc-world-facts.md, and until a host observes it the condition still answers false rather than defaulting. This is a statement about this engine's writers, not about the original: no fidelity, verified_original or release_approved claim about M01 objective completion stands on it, and a Rally merge awards checked. TEST-SELECTION NOTE: the prefixes accept_m01_lc_lowering_adapter_ and accept_m01_lc_directive_lowering_ are unique to this task, so the 14 discovered assertions are exactly this task's tests. Validated with tools/validate_evidence.py --require-pass."},
 "claim": "implemented"
}
