{
 "schema_version": 1,
 "task_id": "F14-D.3",
 "candidate_tree": "8a0b780958c1cdbdab110a49d53d448cde06caf3",
 "engine": {"rust": "rustc 1.98.1 (48a229cea 2026-09-01)", "bevy": "0.19.1", "avian": "0.7.0"},
 "created_at": "2026-10-03T01:15:12Z",
 "command": {"argv": ["cargo", "test", "--workspace", "--locked", "--", "accept_f14_d_3_", "--include-ignored"], "cwd": "/Users/linus/coding/rust-crimson-skies/bunny-alpha-1", "exit_code": 0},
 "source": {"install_sha256": "b4e780ab84cf31d85b8452fbfcec1478137768e32d9a75ccedc4c1847c631978", "content_sha256": "a0223506e512b50c0e0445ba73204a0461e60197e28d58a7f7144632d262c12d"},
 "seed": 0,
 "ticks": {"start": 0, "end": 0},
 "overrides": [],
 "capabilities": ["retail", "synthetic"],
 "tests": {"discovered": 5, "executed": 5, "passed": 5, "failed": 0, "ignored": 0},
 "assertions": [{"id": "accept_f14_d_3_no_readable_world_group_reader_is_a_named_gap_not_an_empty_reading", "status": "pass", "evidence": ["cargo-test.log"]}, {"id": "accept_f14_d_3_world_rows_are_not_launchable_and_the_denominator_does_not_move", "status": "pass", "evidence": ["cargo-test.log"]}, {"id": "accept_f14_d_3_a_world_group_reader_that_cannot_be_listed_is_named_not_invented", "status": "pass", "evidence": ["cargo-test.log"]}, {"id": "accept_f14_d_3_a_classified_world_group_reader_yields_a_world_row", "status": "pass", "evidence": ["cargo-test.log"]}, {"id": "accept_f14_d_3_retail_every_world_group_reader_the_installation_names_is_a_row", "status": "pass", "evidence": ["cargo-test.log"]}],
 "artifacts": [{"path": "cargo-test.log", "sha256": "81bce79b60eb4d58273b5fca675efd41cd80afca7e4dc901aa07b6538c6449da", "kind": "log"}, {"path": "baseline-report.json", "sha256": "22cd2b3ad2f920b757a1a7355b4a9664ad37d36e8c4b12255717742a230f51bc", "kind": "json"}],
 "unknowns": [],
 "review": {"identity": "implementer: bunny-alpha-1/bunny-alpha-1 (Rally #486, implement claim of 2026-10-03T00:47:15Z). No review claim had run when this report was generated, so the implementer is the only identity recorded: the reviewing agent replaces this literal and names itself here in the same commit that regenerates the report. The reviewing session should record whether its context was fresh. `checked` is the ceiling for an agent review and no agent review replaces the owner's human approval", "method": "acceptance suite run locally with the retail capability; this harness derives every field from the recorded log, production discovery of $CS_GAME_DIR, the production baseline report over that installation, rustc and Cargo.lock; validated with tools/validate_evidence.py --require-pass. The consumer trace is cs_content::catalog::baseline::retail_baseline + baseline_report_json, the same functions `cs-inspect catalog --cs-path` writes. The world rows are named by the producing stage's own classifier (cs_content::catalog::reader_dirs::classify reading each world-group reader's member index through cs_assets::zbd::audit_containers), not by a reader derived for this task, and the identity is the group directory lowercased, the derivation cs_content::campaign_bindings already uses for a mission binding's world row. Implementer mutation probes on this branch: removing the world_rows call from retail_baseline, keying a world row by anything but the group directory, and clearing the collection's declared_group_without_reader gap each fail the acceptance tests named in the finding. LIMITATION: Six of the collections IDENTITY-CONTENT requires are now populated: install files, campaign missions, mission programs, the instant-action and multiplayer scenario directories (F14-D.1), multiplayer rules (F14-D.2) and world groups (this stage). Affected content: world *variants* inside a group, airframes, loadouts, factions, weapons, sounds, dialogue, media, stunts and scrapbook items, which still have no source-derived row. Resolving tasks: the follow-up tasks created from #389, one per collection, each adding at most the rows its producing stage's parser can honestly produce; the report's collections and collection_status objects state what exists today. LIMITATION: A world row is a world *group*, not a variant inside it, and no member of a shared reader is decoded. Affected content: every variant, sector, object instance and mesh of all eight groups. Resolving tasks: #392 (decode the GameZ node array), F18-E (#436, the placement and the stored vertex unit) and the scene/mesh collection task created from #389. LIMITATION: A world row is located by its reader archive as a whole (offset 0, the archive's length) because the classifier reads the member index, not a member payload; the row therefore pins the archive rather than the bytes of one member. Affected content: every world row's precision about which member named it. Resolving task: the variant/scene stages that read member payloads and can narrow the span. LIMITATION: Nothing references a world yet, so the world rows are unreachable from the declared roots and stay counted in coverage.unreachable_by_kind and unreachable_needing_classification. Affected content: the reachability accounting of the world collection. Resolving task: F18-E / the scene stage, when a mission or scenario row points at the world it runs in. LIMITATION: The classification a world row rests on is a group the campaign walk declares AND whose own shared reader lists the shared world members; a world group with no campaign mission would yield no row. Affected content: any world the original ships without a mission. Resolving task: the discovery stage (F02-D's world_groups) if a capture ever shows one; on the owner's installation every group carries at least one mission, measured as eight of eight. LIMITATION: No row claims a runtime consumer and no member program is decoded, so the coverage accounting reports 0 ready and every launchable row as unsupported. Affected content: every campaign mission's and scenario directory's readiness. Resolving tasks: F37 (mission IR) and F38 (native behavior bindings)."},
 "claim": "implemented"
}
