{
 "schema_version": 1,
 "task_id": "F38-D.1",
 "candidate_tree": "e311924efa7dfe5e9c6b37fa840a3a0b139f063f",
 "engine": {"rust": "rustc 1.98.1 (48a229cea 2026-09-01)", "bevy": "0.19.1", "avian": "0.7.0"},
 "created_at": "2026-10-14T09:03:40Z",
 "command": {"argv": ["cargo", "test", "--workspace", "--locked", "--", "accept_f38_d1_", "--include-ignored"], "cwd": "/Users/linus/coding/rust-crimson-skies/bunny-alpha-1", "exit_code": 0},
 "source": {"install_sha256": "b4e780ab84cf31d85b8452fbfcec1478137768e32d9a75ccedc4c1847c631978", "content_sha256": "a0223506e512b50c0e0445ba73204a0461e60197e28d58a7f7144632d262c12d"},
 "seed": 0,
 "ticks": {"start": 0, "end": 0},
 "overrides": [],
 "capabilities": ["retail", "synthetic"],
 "tests": {"discovered": 6, "executed": 6, "passed": 6, "failed": 0, "ignored": 0},
 "assertions": [{"id": "accept_f38_d1_protocol_variation_is_judged_not_dropped", "status": "pass", "evidence": ["cargo-test.log"]}, {"id": "accept_f38_d1_the_family_key_keeps_the_native", "status": "pass", "evidence": ["cargo-test.log"]}, {"id": "accept_f38_d1_the_measured_hosts_bind_with_their_measured_meanings", "status": "pass", "evidence": ["cargo-test.log"]}, {"id": "accept_f38_d1_unmeasured_families_are_named_and_never_bound", "status": "pass", "evidence": ["cargo-test.log"]}, {"id": "accept_f38_d1_retail_the_native_census_matches_the_owner_measurement", "status": "pass", "evidence": ["cargo-test.log"]}, {"id": "accept_f38_d1_retail_the_audit_binds_the_measured_hosts_and_names_the_rest", "status": "pass", "evidence": ["cargo-test.log"]}],
 "artifacts": [{"path": "cargo-test.log", "sha256": "2b4a70fe40b8ef64befd7b4231f47ebefa0f9c9a62edca28e8ce1abf74c63ea1", "kind": "log"}, {"path": "native-family-audit.json", "sha256": "2d031ff8730c072ad466f9a02cb2c99d19e27ea75f8dea4846e1c598a30b6e93", "kind": "json"}],
 "unknowns": [],
 "review": {"identity": "implementer: bunny-alpha-1 (Rally #694, implement claim of 2026-10-14, session that produced commits 8ea51171..403e0b44). REVIEWER: bunny-alpha-1 again on the review claim of 2026-10-14 — same agent identity and model, but a different session whose context was fresh: it did not write the implementation and re-read the task, the #159 owner note, the spec, the contract and every diff from scratch. Because the identity is the same, this review is NOT independent original-reference evidence, and no agent review replaces the owner's human approval. During review the reviewer found and fixed one validation gap (a MeasuredCallRow whose shape table was narrower than its widest observed arity was accepted, which would have left a site's trailing argument positions unchecked by the audit) and regenerated this report on the reviewed commit. The semantic source is the owner note on Rally #159 (2026-10-05) over the decrypted executable (sha256 43540fc97347210d6f4c10b77edbd4cdab1f03d57554d638223c2430a6c37d75): static code evidence, never verified_original.", "method": "Regenerated by the reviewing agent on the reviewed commit (with the review's ProtocolWidthMismatch fix included), as docs/contracts/CLI-EVIDENCE.md requires of a reviewer; every run fact below is this run's own. Acceptance suite run locally with the retail capability; this harness derives every field from the recorded log, production discovery of $CS_GAME_DIR, and the production ROF reader, host-call scanner, family table and site audit run over the installation (native-family-audit.json: per-native census, per-site member, offset, verdict and family spelling, and the unmeasured families named by native and id; no program text). The re-keyed census: 61 UI script programs, 1812 sites, of which 709 are callback sites attributable to the five measured natives over 385 distinct (native, id) pairs (the id 6 under two natives), 1102 mail sites, and 1 callback \\\n             site whose $$X$$ target is outside the five-native table and keeps its own unmeasured family. 1287 sites bind to a measured meaning (174 goslocalize + 11 gospageinit + 1102 mail), 525 refuse (524 goscallback/uidata/uicontrol + 1 unmeasured-target, across 245 families named in totals.unmeasured_families), 3188 call-shaped heads outside the two measured forms are counted as unjudged, and campaign_ready is false. LIMITS (stated in full in docs/findings/scripts/2026-10-14-f38-d1-rekeyed-native-families.md, not removed to pass this validator): (1) the per-value meaning of every goscallback, uidata and uicontrol dispatch value (57 + 169 + 16 ids) is unmeasured and open on Rally #159, so those sites refuse and the audit refuses campaign-ready; (2) the five-native dispatch-target table and the three measured meanings are the owner's static analysis of the decrypted executable, not an original run, and no original run was observed; (3) these are the UI script programs, not the mission language -- the mission programs are not decoded (F13-D); (4) a bound family is a measured meaning, not a mission-registry entry: the mission registry stays empty and a mission program referencing a UI host call must still fail validation before flight; (5) the differential-trace identity is still (form, value), not (host, value); a follow-up task is filed. Validated with tools/validate_evidence.py --require-pass."},
 "claim": "implemented"
}
